{
  "$schema": "https://json-schema.org/draft/2020-12/schema",
  "$id": "tools/blender/anim.schema.json",
  "title": "Mascot animation clips (Claude-written) for tools/blender/build_actions.py",
  "description": "Key poses per bone or morph target, eased with named presets, with holds, time offsets (overlap) and chains. Semantics: tools/blender/README.md#animation-json. Frames are at `fps` (30 per ANIMATION_CONTRACT). A key's `ease` shapes the motion ARRIVING at that key.",
  "type": "object",
  "additionalProperties": false,
  "required": ["clips"],
  "properties": {
    "$schema": { "type": "string" },
    "version": { "const": 1 },
    "fps": { "type": "integer", "minimum": 1, "maximum": 120, "description": "Default 30." },
    "rig": { "type": "string", "description": "Free text: which rig/.blend this was authored against." },
    "notes": { "type": "string" },
    "defaults": {
      "type": "object",
      "additionalProperties": false,
      "properties": {
        "space": { "enum": ["world", "local"] },
        "ease": { "$ref": "#/$defs/ease" }
      }
    },
    "clips": { "type": "array", "minItems": 1, "items": { "$ref": "#/$defs/clip" } }
  },
  "$defs": {
    "ease": {
      "anyOf": [
        { "type": "string", "minLength": 1, "description": "Preset like BACK_OUT, ELASTIC_OUT, BOUNCE_OUT, SINE_IN_OUT, QUAD_IN, EXPO_OUT, LINEAR, CONSTANT, BEZIER, or an alias: STEP/HOLD, SMOOTH, EASE, ANTICIPATE, OVERSHOOT, SETTLE, SNAP, DROP, THUD." },
        {
          "type": "object",
          "additionalProperties": false,
          "required": ["type"],
          "properties": {
            "type": { "enum": ["CONSTANT", "LINEAR", "BEZIER", "SINE", "QUAD", "CUBIC", "QUART", "QUINT", "EXPO", "CIRC", "BACK", "BOUNCE", "ELASTIC"] },
            "dir": { "enum": ["IN", "OUT", "IN_OUT", "AUTO"] },
            "back": { "type": "number", "minimum": 0, "description": "BACK overshoot amount (Blender default 1.70158)." },
            "amplitude": { "type": "number", "minimum": 0, "description": "ELASTIC wobble size as a fraction of the segment's change (default 1.0)." },
            "period": { "type": "number", "minimum": 0, "description": "ELASTIC period in frames (default: 30% of the segment)." }
          }
        }
      ]
    },
    "value": {
      "anyOf": [
        { "type": "number" },
        { "type": "array", "minItems": 3, "maxItems": 3, "items": { "type": "number" } }
      ]
    },
    "key": {
      "type": "object",
      "additionalProperties": false,
      "required": ["f", "v"],
      "properties": {
        "f": { "type": "number", "minimum": 0, "description": "Frame (0 = clip start)." },
        "v": { "$ref": "#/$defs/value", "description": "rot: [x,y,z] degrees; loc: [x,y,z] metres; scale: [x,y,z] or s; squash: sy (sx = sz = 1/sqrt(sy)); morph: weight 0..1." },
        "ease": { "$ref": "#/$defs/ease" },
        "hold": { "type": "number", "minimum": 0, "description": "Hold this value for N frames before moving on (2-4 frame holds sell a pose)." }
      }
    },
    "track": {
      "type": "object",
      "additionalProperties": false,
      "required": ["keys"],
      "properties": {
        "bone": { "type": "string" },
        "chain": { "type": "array", "minItems": 1, "items": { "type": "string" }, "description": "Bones root->tip; expands into one track per bone." },
        "offsetStep": { "type": "number", "description": "chain: extra frames of delay per link (follow-through). Default 2." },
        "falloff": { "type": "number", "minimum": 0, "description": "chain: amplitude multiplier per link. Default 1." },
        "morph": { "type": "string", "description": "Shape key name (e.g. surprised); every mesh that has it unless `mesh` is given." },
        "mesh": { "type": "string" },
        "channel": { "enum": ["rot", "loc", "scale", "squash", "morph"] },
        "space": { "enum": ["world", "local"], "description": "rot/loc axes. world (default): Blender world axes at the base pose; the character faces -Y, +Z is up. local: the bone's own axes." },
        "offset": { "type": "number", "description": "Shift the whole track by N frames (overlap). Wraps around on loops." },
        "loopEase": { "$ref": "#/$defs/ease", "description": "Ease of the auto-added closing key on loops." },
        "keys": { "type": "array", "minItems": 1, "items": { "$ref": "#/$defs/key" } }
      }
    },
    "clip": {
      "type": "object",
      "additionalProperties": false,
      "required": ["name", "length", "tracks"],
      "properties": {
        "name": { "type": "string", "pattern": "^[a-z][a-z0-9_]*$", "description": "Canonical names: ANIMATION_CONTRACT §7.2." },
        "loop": { "type": "boolean" },
        "length": { "type": "integer", "minimum": 1, "description": "Last frame; the clip spans 0..length." },
        "base": {
          "anyOf": [
            { "type": "string", "description": "'rest' or the name of an existing action to take the base pose from (frame 0)." },
            {
              "type": "object",
              "additionalProperties": false,
              "required": ["action"],
              "properties": { "action": { "type": "string" }, "frame": { "type": "number" } }
            }
          ]
        },
        "notes": { "type": "string" },
        "tracks": { "type": "array", "minItems": 1, "items": { "$ref": "#/$defs/track" } }
      }
    }
  }
}
